{
  "documentType": "d2p:sim-report",
  "schemaVersion": "1.0.0",
  "simReportId": "smr_golden-drape-size-b-body-m",
  "createdAt": "2026-01-09T00:00:00Z",
  "sceneSnapshotRef": {
    "id": "ssn_golden-drape-size-b-body-m",
    "digest": "sha256:1fa2a88a16dd7526740676815a7ed03458124bdacd88ebb05d87b09790e7e8ac"
  },
  "profileKind": "fit-approximation",
  "solver": {
    "backendId": "conformance-kit-cylinder-drape",
    "backendVersion": "1.0.0",
    "adapterVersion": "1.0.0"
  },
  "solverProfile": {
    "id": "d2p:fit-approximation",
    "version": "1.0.0"
  },
  "materialPhysicsProfile": {
    "id": "d2p:cotton-woven",
    "version": "1.0.0"
  },
  "toleranceProfile": {
    "id": "d2p:golden-tshirt-drape",
    "version": "1.0.0"
  },
  "inputDigests": [
    {
      "role": "avatar-profile",
      "id": {
        "id": "d2p:standard-a-pose",
        "version": "1.0.0"
      },
      "digest": "sha256:eb2094d481aa927d2f18cb8773e02dc4efb8ef4ad403d88ccffbabc6992760f9"
    },
    {
      "role": "garment",
      "artifactRef": {
        "artifactId": "art_golden-tshirt-drape-garment-size-b",
        "revisionId": "rev_golden-tshirt-drape-garment-size-b-r1"
      },
      "digest": "sha256:4d16ee4f0a04c025a9153376142085927cd881ebadb7d85a429f8e205cb761c0"
    },
    {
      "role": "material-physics-profile",
      "id": {
        "id": "d2p:cotton-woven",
        "version": "1.0.0"
      },
      "digest": "sha256:066dcfe5d9ccb96ddaec2316c4ee12dd8785dcfcecd4e1d1e3ed2da09217b8b6"
    },
    {
      "role": "mesh-profile",
      "id": {
        "id": "d2p:drape-coarse",
        "version": "1.0.0"
      },
      "digest": "sha256:553399d79156ee0d9e5ab0e59462a5bdcb7391289696260f421ba02b041743fc"
    },
    {
      "role": "pattern",
      "artifactRef": {
        "artifactId": "art_golden-tshirt-pattern",
        "revisionId": "rev_golden-tshirt-pattern-r1"
      },
      "digest": "sha256:ef7edb92161d6db884d89db7b16baac1e1432e26e9d9ff1f1a1ce23649eb6949"
    },
    {
      "role": "size-system",
      "artifactRef": {
        "artifactId": "art_golden-drape-body-sizes",
        "revisionId": "rev_golden-drape-body-sizes-r1"
      },
      "digest": "sha256:b932325a7d31b22c0b91d73363a2217530001c46beadca222bdf1e2563240cb6"
    },
    {
      "role": "solver-profile",
      "id": {
        "id": "d2p:fit-approximation",
        "version": "1.0.0"
      },
      "digest": "sha256:883af366b00929c501f2c325721e8c18a3daab73a53b6f72f119b9eca2761d94"
    }
  ],
  "randomSeed": 1,
  "status": "succeeded",
  "convergence": "converged",
  "durationMs": 1250,
  "metrics": [
    {
      "metric": "d2p:drape-penetration",
      "value": 0,
      "unit": "mm"
    },
    {
      "metric": "d2p:drape-seam-gap",
      "value": 0.8,
      "unit": "mm"
    }
  ],
  "diagnostics": [],
  "resultDigest": "sha256:e643984dd4da5dbd439a18f85849b4604f8770b2f877bae07adac720e5b8af0d"
}
